,4/7/20,4/8/20,4/9/20
60th Medical Group - Travis AFB (AKA David Grant USAF Medical Center),NA,NA,NA
633rd Medical Group - USAF Hospital Langley,NA,NA,NA
673d Medical Group - Joint Base Elmendorf-Richardson,NA,NA,NA
81st Medical Group - Keesler AFB,NA,NA,NA
88th Medical Group - Wright-Patterson Medical Center,NA,NA,NA
96th Medical Group - Eglin AFB,NA,NA,NA
99th Medical Group - Mike OCallaghan Military Medical Center,NA,NA,NA
AHMC Anaheim Regional Medical Center,0.5473432,0.547343,NA
AHN Brentwood Neighborhood Hospital,NA,NA,NA
AHN Grove City (FKA Grove City Medical Center),0.1448845,0.144884,NA
AHN Hempfield Neighborhood Hospital,NA,NA,NA
AMG Physical Rehabilitation Hospital - Covington,0.6767123,0.6767123,NA
AMG Specialty Hospital - Albuquerue,0.8158904,0.8158904,NA
AMG Specialty Hospital - Central Indiana Hancock,NA,NA,NA
AMG Specialty Hospital - Houma,0.4916438,0.4916438,NA
AMG Specialty Hospital - Lafayette,0.8532724,0.8532724,NA
AMG Specialty Hospital - Las Vegas (FKA Progressive Hospital),0.5342466,0.534247,NA
AMG Specialty Hospital - Mercy,NA,NA,NA
AMG Specialty Hospital - Muncie (FKA Integra Specialty Hospital),0.5581236,0.558124,NA
AMG Specialty Hospital - Zachary (FKA AMG Specialty Hospital - Feliciana),0.6945205,0.6945205,NA
AMITA Health Adventist Medical Center Bolingbrook,0.4950187,0.495019,NA
AMITA Health Adventist Medical Center GlenOaks,0.5141253,0.514125,NA
AMITA Health Adventist Medical Center Hinsdale,0.5171906,0.517191,NA
AMITA Health Adventist Medical Center La Grange,0.5477557,0.547756,NA
AMITA Health Alexian Brothers Behavioral Health Hospital Hoffman Estates,0.867269,0.867269,NA
AMITA Health Alexian Brothers Medical Center Elk Grove Village,0.7408987,0.740899,NA
AMITA Health Holy Family Medical Center Des Plaines (FKA Presence Holy Family Medical Center),0.6640197,0.6640197,NA
AMITA Health Mercy Medical Center Aurora (FKA Presence Mercy Medical Center),0.3634363,0.363436,NA
AMITA Health Resurrection Medical Center Chicago (FKA Presence Resurrection Medical Center),0.7066935,0.706693,NA
AMITA Health Saint Francis Hospital Evanston (FKA Presence Saint Francis Hospital),0.4486642,0.448664,NA
AMITA Health Saint Joseph Hospital Chicago (FKA Presence Saint Joseph Hospital - Chicago),0.4147093,0.414709,NA
AMITA Health Saint Joseph Hospital Elgin (FKA Presence Saint Joseph Hospital - Elgin),0.4883752,0.488375,NA
AMITA Health Saint Joseph Medical Center Joliet (FKA Presence Saint Joseph Medical Center),0.4509434,0.450943,NA
AMITA Health Saint Mary and Elizabeth Medical Center Chicago - Saint Mary Campus (FKA Presence Saint Mary and Elizabeth Medical Center - Saint Mary Campus),0.600348,0.600348,NA
AMITA Health St Alexius Medical Center Hoffman Estates,0.6093564,0.609356,NA
AMITA Health St Marys Hospital Kankakee (FKA Presence St Marys Hospital),0.3294642,0.329464,NA
ARH Our Lady of the Way (FKA St Joseph Martin),0.3132055,0.313206,NA
Abbeville Area Medical Center,0.3270137,0.327014,NA
Abbeville General Hospital,0.3305728,0.330573,NA
Abbott Northwestern Hospital,0.7180049,0.718005,NA
Abilene Regional Medical Center,0.3037,0.3037,NA
Abington - Lansdale Hospital (FKA Lansdale Hospital),0.3866341,0.386634,NA
Abington Hospital - Jefferson Health (FKA Abington Memorial Hospital),0.5903447,0.590345,NA
Abraham Lincoln Memorial Hospital,0.4291507,0.429151,NA
Abrazo Arrowhead Campus (FKA Arrowhead Hospital),0.5997804,0.59978,NA
Abrazo Central Campus (FKA Phoenix Baptist Hospital),0.6105835,0.610583,NA
Abrazo Mesa Hospital,NA,NA,NA
Abrazo Scottsdale Campus (FKA Paradise Valley Hospital),0.4222414,0.422241,NA
Abrazo West Campus (FKA West Valley Hospital),0.743629,0.743629,NA
Abrom Kaplan Memorial Hospital,0.325589,0.325589,NA
Acadia - St Landry Hospital,0.6673973,0.6673973,NA
Acadia General Hospital (FKA American Legion Hospital),0.1834442,0.183444,NA
Accel Rehabilitation Hospital of Plano,0.1101774,0.1101774,NA
Access Hospital Dayton,0.4152284,0.4152284,NA
Accord Rehabilitation Hospital,0.6841096,0.6841096,NA
Acoma-Canoncito-Laguna Service Unit,0.05570776,0.055708,NA
Acuity Specialty Hospital of Morgantown,NA,NA,NA
Acuity Specialty Hospital of New Jersey,0.8203653,0.8203653,NA
Acuity Specialty Hospital of Ohio Valley - Belmont Campus,0.5572298,0.5572298,NA
Acuity Specialty Hospital of Ohio Valley - Weirton Campus,NA,NA,NA
Acuity Specialty Hospital of Ohio Valley - Wheeling Campus,NA,NA,NA
Acuity Specialty Hospital of Southern New Jersey (FKA Lourdes Specialty Hospital of Southern New Jersey),0.5316657,0.531666,NA
AdCare Hospital of Worcester,0.913963,0.913963,NA
Adair County Memorial Hospital,0.04427397,0.044274,NA
Adams County Regional Medical Center,0.5430137,0.543014,NA
Adams Memorial Hospital,0.6100822,0.610082,NA
Adena Greenfield Medical Center,0.3171507,0.317151,NA
Adena Pike Medical Center,0.2883288,0.288329,NA
Adena Regional Medical Center,0.5605422,0.560542,NA
Adirondack Medical Center - Saranac Lake,0.2499092,0.249909,NA
Admin De Servicios Medicos Puerto Rico,0.8624899,0.86249,NA
Advanced Care Hospital of Montana,0.744589,0.744589,NA
Advanced Care Hospital of Southern New Mexico,0.7160274,0.716027,NA
Advanced Diagnostics Hospital East (FKA Victory Surgical Hospital East Houston),0.859589,0.859589,NA
Advanced Specialty Hospitals of Toledo,0.4653425,0.465342,NA
Advanced Surgical Hospital,0.2800391,0.2800391,NA
AdventHealth Carrollwood (FKA Florida Hospital Carrollwood),0.5150685,0.515069,NA
AdventHealth Central Texas (FKA Metroplex Adventist Hospital),0.3133166,0.313317,NA
AdventHealth Connerton (FKA Florida Hospital at Connerton - Long Term Acute Care),0.9751233,0.9751233,NA
AdventHealth Dade City (FKA Florida Hospital Dade City),0.1573315,0.157332,NA
AdventHealth Daytona Beach (FKA Florida Hospital Memorial Medical Center),0.7219411,0.721941,NA
AdventHealth DeLand (FKA Florida Hospital DeLand),0.59372,0.59372,NA
AdventHealth Durand (FKA Chippewa Valley Hospital),0.1429041,0.1429041,NA
AdventHealth Fish Memorial (FKA Florida Hospital Fish Memorial),0.6536619,0.653662,NA
AdventHealth Gordon (FKA Gordon Hospital),0.6426444,0.642644,NA
AdventHealth Heart of Florida (FKA Heart of Florida Regional Medical Center),0.5200937,0.520094,NA
AdventHealth Hendersonville (FKA Park Ridge Health),0.479377,0.479377,NA
AdventHealth Lake Wales (FKA Lake Wales Medical Center),0.357036,0.357036,NA
AdventHealth Manchester (FKA Manchester Memorial Hospital),0.2963377,0.296338,NA
AdventHealth Murray (FKA Murray Medical Center),0.1487955,0.148795,NA
AdventHealth New Smyrna Beach (FKA Florida Hospital New Smyrna),0.603547,0.603547,NA
AdventHealth North Pinellas (FKA Florida Hospital North Pinellas),0.4193392,0.419339,NA
AdventHealth Ocala (FKA Florida Hospital Ocala),0.5456305,0.545631,NA
AdventHealth Orlando (FKA Florida Hospital Orlando),0.6353567,0.635357,NA
AdventHealth Ottawa (FKA Ransom Memorial Hospital),0.2388298,0.23883,NA
AdventHealth Palm Coast (FKA Florida Hospital Flagler),0.9044694,0.904469,NA
AdventHealth Rollins Brook (FKA Rollins Brook Community Hospital),0.3123288,0.312329,NA
AdventHealth Sebring (FKA Florida Hospital Heartland Medical Center),0.6683714,0.668371,NA
AdventHealth Shawnee Mission (FKA Shawnee Mission Medical Center),0.6462414,0.646241,NA
AdventHealth Tampa (FKA Florida Hospital Tampa),0.6160377,0.616038,NA
AdventHealth Waterman (FKA Florida Hospital Waterman),0.6512298,0.65123,NA
AdventHealth Wauchula (FKA Florida Hospital Wauchula),0.9115617,0.911562,NA
AdventHealth Wesley Chapel (FKA Florida Hospital Wesley Chapel),0.4305716,0.4305716,NA
AdventHealth Winter Garden (FKA Florida Hospital Winter Garden),NA,NA,NA
AdventHealth Zephyrhills (FKA Florida Hospital Zephyrhills),0.604174,0.604174,NA
Adventist Health Bakersfield (FKA San Joaquin Community Hospital),0.6873369,0.687337,NA
Adventist Health Castle (FKA Castle Medical Center),0.5240582,0.524058,NA
Adventist Health Clear Lake (FKA St Helena Hospital - Clear Lake),0.6169863,0.616986,NA
Adventist Health Glendale (FKA Glendale Adventist Medical Center),0.6495655,0.649566,NA
Adventist Health Hanford,0.5143895,0.51439,NA
Adventist Health Howard Memorial (FKA Frank R Howard Memorial Hospital),0.7786301,0.77863,NA
Adventist Health Lodi Memorial,0.4907572,0.490757,NA
Adventist Health Portland,0.4800718,0.480072,NA
Adventist Health Reedley,0.2302488,0.230249,NA
Adventist Health Simi Valley (FKA Simi Valley Hospital & Health Care Services),0.4947869,0.494787,NA
Adventist Health Sonora (FKA Sonora Regional Medical Center),0.506882,0.506882,NA
Adventist Health St Helena (FKA St Helena Hospital - Napa Valley),0.4611715,0.461172,NA
Adventist Health Tehachapi Valley (FKA Tehachapi Hospital),0.3249012,0.324901,NA
Adventist Health Tillamook (FKA Tillamook County General Hospital),0.4831781,0.483178,NA
Adventist Health Tulare (FKA Tulare Regional Medical Center),0.08522727,0.085227,NA
Adventist Health Ukiah Valley (FKA Ukiah Valley Medical Center),0.6238356,0.623836,NA
Adventist Health Vallejo,0.867011,0.867011,NA
Adventist Health White Memorial (FKA White Memorial Medical Center),0.6733009,0.673301,NA
Adventist HealthCare Rehabilitation - Rockville (FKA Adventist Rehabilitation Hospital - Rockville),0.8025243,0.8025243,NA
Adventist HealthCare Shady Grove Medical Center,0.782777,0.782777,NA
Adventist HealthCare Shady Grove Medical Center - Mental Health,0.6887493,0.688749,NA
Adventist HealthCare Takoma Park,NA,NA,NA
Adventist HealthCare White Oak Medical Center,0.6362501,0.6362501,NA
Advocate BroMenn Medical Center,0.3744514,0.374451,NA
Advocate Christ Medical Center,0.8197299,0.81973,NA
Advocate Condell Medical Center,0.6778664,0.677866,NA
Advocate Eureka Hospital,0.1324932,0.132493,NA
Advocate Good Samaritan Hospital,0.765838,0.765838,NA
Advocate Good Shepherd Hospital,0.5885118,0.588512,NA
Advocate Illinois Masonic Medical Center,0.5133077,0.513308,NA
Advocate Lutheran General Hospital,0.7114137,0.711414,NA
Advocate Sherman Hospital,0.5789095,0.578909,NA
Advocate South Suburban Hospital,0.4362044,0.436204,NA
Advocate Trinity Hospital,0.3856607,0.385661,NA
Aiken Regional Medical Centers,0.6338172,0.633817,NA
Akron Childrens Hospital,0.5365705,0.5365705,NA
Akron General,0.7066609,0.706661,NA
Akron General Lodi Hospital,0.2642466,0.264247,NA
Al Rashid Health and Wellness Center,NA,NA,NA
Alameda Hospital,0.9777599,0.97776,NA
Alaska Native Medical Center,0.6080512,0.608051,NA
Alaska Psychiatric Institute,0.5002397,0.5002397,NA
Alaska Regional Hospital,0.5651687,0.565169,NA
Alaska VA Healthcare System,NA,NA,NA
Albany Medical Center,0.7719316,0.771932,NA
Albany Stratton VA Medical Center,NA,NA,NA
Albert Solnit Psychiatric Childrens Center - South Campus,NA,NA,NA
Aleda E Lutz VA Medical Center (AKA Saginaw VA Medical Center),NA,NA,NA
Alexandria VA Health Care System (AKA Alexandria VA Medical Center),NA,NA,NA
Alhambra Hospital Medical Center,0.5441747,0.544175,NA
Alice Hyde Medical Center,0.2934875,0.293488,NA
Alice Peck Day Memorial Hospital,0.5568493,0.556849,NA
Allegan General Hospital,0.2482192,0.248219,NA
Alleghany Memorial Hospital (AKA Allegheny Health),0.1484932,0.148493,NA
Allegheny General Hospital,0.7007931,0.700793,NA
Allegheny Valley Hospital,0.2627263,0.262726,NA
Allegiance Behavioral Center of Monroe,NA,NA,NA
Allegiance Behavioral Health Center of Plainview,NA,NA,NA
Allegiance Health Center of Ruston,0.8900196,0.8900196,NA
Allegiance Specialty Hospital of Greenville,0.5596768,0.5596768,NA
Allen County Regional Hospital,0.3499178,0.349918,NA
Allen Hospital (FKA Allen Memorial Hospital),0.456582,0.456582,NA
Allen Parish Hospital,0.1690959,0.169096,NA
Allendale County Hospital,0.1715069,0.1715069,NA
Alliance Health Center,0.2233042,0.223304,NA
Alliance Hospital (AKA Alliance HealthCare System),0.2033485,0.203348,NA
AllianceHealth Clinton (FKA Integris Clinton Regional Hospital),0.1380213,0.138021,NA
AllianceHealth Durant (FKA Medical Center of Southeastern Oklahoma),0.3170255,0.317026,NA
AllianceHealth Madill (FKA Integris Marshall County Medical Center),0.2166993,0.216699,NA
AllianceHealth Midwest (FKA Midwest Regional Medical Center),0.3512654,0.351265,NA
AllianceHealth Ponca City,0.4400685,0.440068,NA
AllianceHealth Seminole (FKA Integris Seminole Medical Center),0.1797089,0.179709,NA
AllianceHealth Woodward (FKA Woodward Regional Hospital),0.2193151,0.219315,NA
Allied Rehab Hospital (FKA Allied Services Rehab Hospital),0.3864016,0.386402,NA
Alomere Health (FKA Douglas County Hospital),0.2963609,0.296361,NA
Alta Bates Summit Medical Center - Alta Bates Campus,0.4132872,0.413287,NA
Alta Bates Summit Medical Center - Summit Campus,0.4841349,0.484135,NA
Alta View Hospital,0.3085026,0.308503,NA
Alta Vista Regional Hospital,0.1953544,0.195354,NA
Alton Memorial Hospital,0.5001868,0.500187,NA
Alton Mental Health Center,0.5600457,0.5600457,NA
Altru Hospital,0.4959382,0.495938,NA
Altru Specialty Center,NA,NA,NA
Altus Baytown Hospital,0.153816,0.153816,NA
Altus Houston Hospital,NA,NA,NA
Altus Lumberton ER Hospital,NA,NA,NA
Alvarado Hospital Medical Center,0.2535541,0.253554,NA
Alvarado Parkway Institute Behavioral Health System - La Mesa,0.9107929,0.9107929,NA
Amarillo VA Health Care System (AKA Thomas E Creek VA Medical Center),NA,NA,NA
American Fork Hospital,0.4048773,0.404877,NA
American Recovery Center,NA,NA,NA
American River Psychiatric Health Facility,NA,NA,NA
Amery Hospital & Clinic (AKA Amery Regional Medical Center),0.3012603,0.30126,NA
AnMed Health Cannon (FKA Cannon Memorial Hospital),0.1664057,0.166406,NA
AnMed Health Medical Center,0.5912284,0.591228,NA
AnMed Health Rehabilitation Hospital,0.7840183,0.7840183,NA
Anaheim Global Medical Center (FKA Western Medical Center Hospital Anaheim),0.4864477,0.486448,NA
Anchor Hospital,0.7711851,0.7711851,NA
Ancora Psychiatric Hospital,0.781072,0.781072,NA
Andalusia Regional Hospital (AKA Andalusia Health),0.3337184,0.333718,NA
Anderson County Hospital,0.389726,0.389726,NA
Anderson Hospital,0.5083035,0.508304,NA
Anderson Regional Medical Center - North,0.4731612,0.4731612,NA
Anderson Regional Medical Center - South (FKA Riley Hospital),0.520714,0.520714,NA
Androscoggin Valley Hospital,0.4827397,0.48274,NA
Angel Medical Center,0.5516712,0.551671,NA
Animas Surgical Hospital,0.2020548,0.202055,NA
Ann & Robert H Lurie Childrens Hospital of Chicago,0.8037517,0.8037517,NA
Anna Jaques Hospital,0.5593607,0.559361,NA
Anne Arundel Medical Center (FKA Anne Arundel Health System),0.7036325,0.703632,NA
Annie Jeffrey Memorial County Health Center,0.06763699,0.067637,NA
Anoka-Metro Regional Treatment Center,0.7799004,0.7799,NA
Anson General Hospital,0.718591,0.718591,NA
Antelope Memorial Hospital,0.1157832,0.115783,NA
Antelope Valley Hospital (FKA Antelope Valley Hospital Medical Center),0.5537593,0.553759,NA
Apollo Behavioral Health Hospital,0.8272451,0.8272451,NA
Appalachian Behavioral Healthcare Hospital,0.9654258,0.9654258,NA
Appleton Area Health Services,0.156895,0.156895,NA
Appling HealthCare System (FKA Appling Hospital),0.2104754,0.210475,NA
Arbor Health Morton Hospital (FKA Morton General Hospital),0.5854247,0.585425,NA
Arbour Hospital,0.9397261,0.9397261,NA
Arbuckle Memorial Hospital,0.6558904,0.65589,NA
ArchCare at Calvary Hospital - Bronx Campus,0.9462283,0.946228,NA
Archbold Memorial Hospital,0.650394,0.650394,NA
Archer Institute of Lake Charles Memorial Health System,NA,NA,NA
Arden Wood - Christian Science Care Facility,0.5003161,0.5003161,NA
Arise Austin Medical Center (FKA Austin Surgical Hospital),0.1290281,0.129028,NA
Arizona General Hospital - Laveen,0.1875,0.1875,NA
Arizona General Hospital - Mesa,NA,NA,NA
Arizona Spine & Joint Hospital,0.2458606,0.245861,NA
Arizona State Hospital,0.5915913,0.591591,NA
Arkansas Childrens Hospital,0.6638291,0.663829,NA
Arkansas Childrens Northwest,0.4262557,0.4262557,NA
Arkansas Continued Care Hospital of Jonesboro,0.1271785,0.1271785,NA
Arkansas Heart Hospital,0.5682974,0.568297,NA
Arkansas Methodist Medical Center,0.2851478,0.285148,NA
Arkansas State Hospital,0.9073139,0.907314,NA
Arkansas Surgical Hospital,0.387196,0.387196,NA
Arkansas Valley Regional Medical Center,0.4908219,0.490822,NA
Armstrong County Memorial Hospital (AKA ACMH Hospital),0.3077695,0.307769,NA
Arnot Ogden Medical Center,0.5366483,0.536648,NA
Arrowhead Behavioral Health,0.5143836,0.5143836,NA
Arrowhead Regional Medical Center,0.7063478,0.706348,NA
Arroyo Grande Community Hospital,0.3917291,0.391729,NA
Artesia General Hospital,0.1792103,0.17921,NA
Artesian Valley Health System (FKA Meade District Hospital),0.1053425,0.105343,NA
Asante Ashland Community Hospital,0.3916616,0.391662,NA
Asante Rogue Regional Medical Center,0.6584262,0.658426,NA
Asante Three Rivers Medical Center,0.5561644,0.556164,NA
Ascension - Lourdes Counseling Center,0.8016801,0.80168,NA
Ascension All Saints Hospital - Spring Street Campus (FKA Ascension Wheaton Franciscan Healthcare - All Saints),0.5780932,0.578093,NA
Ascension Borgess Hospital,0.5310166,0.531017,NA
Ascension Borgess-Lee Hospital,0.100274,0.100274,NA
Ascension Borgess-Pipp Hospital (FKA Borgess - Pipp Health Center),0.2260593,0.2260593,NA
Ascension Brighton Center for Recovery (FKA Brighton Hospital),0.4587796,0.45878,NA
Ascension Calumet Hospital,0.128548,0.128548,NA
Ascension Columbia St Marys Hospital Milwaukee,0.6682223,0.668222,NA
Ascension Columbia St Marys Hospital Ozaukee,0.4665297,0.46653,NA
Ascension Eagle River Hospital,0.2966732,0.296673,NA
Ascension Genesys Hospital,0.6398513,0.639851,NA
Ascension Good Samaritan Hospital (FKA Ascension Good Samaritan Health Center),0.1035616,0.103562,NA
Ascension Howard Young Medical Center,0.416274,0.416274,NA
Ascension Jane Phillips Medical Center (FKA Jane Phillips Memorial Medical Center),0.4253154,0.425315,NA
Ascension Macomb-Oakland Hospital - Warren Campus,0.6652113,0.665211,NA
Ascension NE Wisconsin - Mercy Campus,0.3452353,0.345235,NA
Ascension NE Wisconsin - St Elizabeth Campus,0.4250769,0.425077,NA
Ascension Our Lady of Victory Hospital,0.1226027,0.122603,NA
Ascension Providence,0.7173577,0.717358,NA
Ascension Providence Hospital - Southfield Campus,0.6402242,0.640224,NA
Ascension Providence Rochester Hospital (FKA Ascension Crittenton Hospital),0.4708003,0.4708,NA
Ascension River District Hospital (FKA St John River District Hospital),0.1193678,0.119368,NA
Ascension SE Wisconsin Hospital - Franklin Campus (FKA Ascension Wheaton Franciscan Healthcare - Franklin),0.7873135,0.787313,NA
Ascension SE Wisconsin Hospital - St Joseph Campus (FKA Wheaton Franciscan St Joseph),0.4697976,0.469798,NA
Ascension Sacred Heart Hospital,0.1276712,0.127671,NA
Ascension Sacred Heart Hospital Bay (AKA Bay Medical Sacred Heart),0.5559867,0.555987,NA
Ascension Sacred Heart Hospital Pensacola,0.5873782,0.587378,NA
Ascension Sacred Heart Hospital on the Emerald Coast,0.5873619,0.587362,NA
Ascension Sacred Heart Hospital on the Gulf,0.2027397,0.2027397,NA
Ascension Sacred Heart Rehabilitation Hospital,0.153816,0.153816,NA
Ascension Saint Thomas Dekalb (FKA Dekalb Community Hospital),0.07507903,0.075079,NA
Ascension Saint Thomas Hickman (FKA Hickman Community Health Services),0.06827397,0.068274,NA
Ascension Saint Thomas Highlands (FKA Highlands Medical Center),0.1171233,0.117123,NA
Ascension Saint Thomas Midtown (FKA Baptist Hospital),0.6245853,0.624585,NA
Ascension Saint Thomas River Park (FKA River Park Hospital),0.1228767,0.122877,NA
Ascension Saint Thomas Rutherford (FKA Middle Tennessee Medical Center),0.740127,0.740127,NA
Ascension Saint Thomas Stones River (FKA Stones River Hospital),0.2189041,0.218904,NA
Ascension Saint Thomas West (FKA St Thomas Hospital),0.778681,0.778681,NA
Ascension Seton Edgar B Davis (FKA Seton Edgar B Davis Hospital),0.3054199,0.30542,NA
Ascension Seton Hays (FKA Seton Medical Center Hays),0.63224,0.63224,NA
Ascension Seton Highland Lakes,0.2952329,0.295233,NA
Ascension Seton Medical Center Austin,0.6084247,0.608425,NA
Ascension Seton Northwest (FKA Seton Northwest Hospital),0.4073921,0.407392,NA
Ascension Seton Shoal Creek (FKA Seton Shoal Creek Hospital),0.3991839,0.399184,NA
Ascension Seton Smithville (FKA Seton Smithville Regional),0.1931507,0.193151,NA
Ascension Seton Southwest (FKA Seton Southwest Hospital),0.05651424,0.056514,NA
Ascension Seton Williamson (FKA Seton Medical Center Williamson),0.7807989,0.780799,NA
Ascension St Clares Hospital,0.4707071,0.470707,NA
Ascension St Francis Hospital (FKA Ascension Wheaton Franciscan Healthcare - St Francis),0.4952279,0.495228,NA
Ascension St John Hospital,0.6115328,0.611533,NA
Ascension St Joseph Hospital,0.1992422,0.199242,NA
Ascension St Marys Hospital,0.3970495,0.397049,NA
Ascension St Marys Hospital (FKA Ascension St Marys of Michigan St Marys Hospital),0.6161966,0.616197,NA
Ascension St Michaels Hospital,0.3587736,0.358774,NA
Ascension St Vincent - Seton,0.489726,0.489726,NA
Ascension St Vincent Anderson (FKA St Johns Health System),0.466153,0.466153,NA
Ascension St Vincent Carmel (FKA St Vincent Carmel Hospital),0.288674,0.288674,NA
Ascension St Vincent Clay (FKA St Vincent Clay Hospital),0.07824658,0.078247,NA
Ascension St Vincent Dunn (FKA St Vincent Dunn Hospital),0.2254247,0.225425,NA
Ascension St Vincent Evansville (FKA St Marys Medical Center - Evansville Campus),0.3779452,0.377945,NA
Ascension St Vincent Hospital - Indianapolis,0.6321603,0.63216,NA
Ascension St Vincent Jennings (FKA St Vincent Jennings Hospital),0.07068493,0.070685,NA
Ascension St Vincent Kokomo,0.3876836,0.387684,NA
Ascension St Vincent Mercy (FKA St Vincent Mercy Hospital),0.0979726,0.097973,NA
Ascension St Vincent Orthopedic Hospital,NA,NA,NA
Ascension St Vincent Randolph,0.1249315,0.124932,NA
Ascension St Vincent Salem,0.05435617,0.054356,NA
Ascension St Vincent Warrick (FKA St Marys Warrick Hospital),0.2843836,0.284384,NA
Ascension St Vincent Williamsport (FKA St Vincent Williamsport Hospital),0.3549657,0.354966,NA
Ascension St Vincents Clay County Hospital,0.5649263,0.5649263,NA
Ascension St Vincents Riverside Hospital,0.5543913,0.554391,NA
Ascension St Vincents Southside Hospital,0.3581608,0.358161,NA
Ascension Standish Hospital (FKA Ascension St Marys of Michigan Standish Hospital),0.1195616,0.119562,NA
Ascension Via Christi Hospital in Manhattan (FKA Mercy Regional Health Center),0.3848678,0.384868,NA
Ascension Via Christi Hospital in Pittsburg,0.3739726,0.373973,NA
Ascension Via Christi Rehabilitation Hospital,0.3440246,0.344025,NA
Ascension Via Christi St Francis,0.6245488,0.624549,NA
Ascension Via Christi St Teresa,0.3140148,0.3140148,NA
Ashe Memorial Hospital,0.5000548,0.500055,NA
Asheville Specialty Hospital,0.7312291,0.731229,NA
Ashford Presbyterian Community Hospital,0.565182,0.565182,NA
Ashland Health Center,0.6470137,0.647014,NA
Ashley County Medical Center,0.3846575,0.384657,NA
Ashley Medical Center,0.1394521,0.139452,NA
Ashley Regional Medical Center,0.2237443,0.223744,NA
Ashtabula County Medical Center,0.4451791,0.445179,NA
Asociacion Hospital Del Maestro,0.3723853,0.372385,NA
Aspen Mountain Medical Center,NA,NA,NA
Aspen Springs Psychiatric Hospital (AKA Lifeways),NA,NA,NA
Aspen Valley Hospital,0.2545753,0.254575,NA
Aspire Behavioral Health of Conroe (AKA Aspire Hospital Behavioral Health),0.08858448,0.08858448,NA
Aspire Health Alliance (FKA South Shore Mental Health),0.7519132,0.751913,NA
Aspire Health Partners (FKA Lakeside Behavioral Healthcare),0.532968,0.532968,NA
Aspirus Iron River Hospital,0.2488767,0.248877,NA
Aspirus Ironwood Hospital,0.3592329,0.359233,NA
Aspirus Keweenaw Hospital,0.3576986,0.3576986,NA
Aspirus Langlade Hospital,0.445589,0.445589,NA
Aspirus Medford Hospital (FKA Memorial Health Center),0.2352877,0.235288,NA
Aspirus Ontonagon Hospital,0.05512329,0.055123,NA
Aspirus Riverview Hospital (FKA Riverview Hospital Association),0.5606088,0.560609,NA
Aspirus Wausau Hospital,0.7459549,0.745955,NA
Assumption Community Hospital,0.02009133,0.020091,NA
Assurance Health Cincinnati,0.6131116,0.6131116,NA
Assurance Health Hudson,0.4016103,0.4016103,NA
Assurance Health Indianapolis,0.8755211,0.8755211,NA
Assurance Health Pasadena,NA,NA,NA
Assurance Health Wilmington,NA,NA,NA
Astria Regional Medical Center (Temporarily Open due to COVID-19),NA,NA,NA
Astria Sunnyside Hospital (FKA Sunnyside Community Hospital & Clinics),0.5806028,0.580603,NA
Astria Toppenish Hospital (FKA Toppenish Community Hospital),0.3338082,0.333808,NA
Atchison Hospital,0.390137,0.390137,NA
Athens-Limestone Hospital,0.5184309,0.518431,NA
Athol Hospital (FKA Athol Memorial Hospital),0.4077808,0.407781,NA
Atlanta VA Medical Center,NA,NA,NA
AtlantiCare Regional Medical Center - Atlantic City Campus,0.6683105,0.668311,NA
Atlantic City Convention Center Field Hospital (Temporarily Open due to COVID-19),NA,NA,NA
Atlantic General Hospital,0.5972032,0.597203,NA
Atlantic Rehabilitation Institute,NA,NA,NA
Atmore Community Hospital,0.3258038,0.325804,NA
Atoka County Medical Center,0.2998356,0.299836,NA
Atrium Health Anson (FKA Carolinas HealthCare System Anson),0.1369863,0.136986,NA
Atrium Health Cabarrus (FKA Carolinas HealthCare System NorthEast),0.6456866,0.645687,NA
Atrium Health Carolinas Medical Center,0.773093,0.773093,NA
Atrium Health Cleveland (FKA Carolinas HealthCare System Cleveland),0.3788325,0.378833,NA
Atrium Health Kings Mountain (FKA Carolinas HealthCare System Kings Mountain),0.3881985,0.388199,NA
Atrium Health Lincoln (FKA Carolinas HealthCare System Lincoln),0.5114336,0.511434,NA
Atrium Health Pineville (FKA Carolinas HealthCare System Pineville),0.9370409,0.9370409,NA
Atrium Health Stanly (FKA Carolinas HealthCare System Stanly),0.3207174,0.320717,NA
Atrium Health Union (FKA Carolinas HealthCare System Union),0.5068945,0.506895,NA
Atrium Health University City (FKA Carolinas Healthcare System University),0.7261918,0.726192,NA
Atrium Medical Center,0.376605,0.247945,NA
Auburn Community Hospital,0.5544239,0.554424,NA
Audubon County Memorial Hospital,0.0729863,0.072986,NA
Augusta Health,0.4650813,0.465081,NA
Augusta University Medical Center (FKA Georgia Regents Medical Center),0.7018677,0.701868,NA
