Ridgeview Behavioral Hospital,0.9871494,0.9871494,NA
Ridgeview Institute - Monroe,0.7219874,0.7219874,NA
Ridgeview Institute - Smyrna,0.7541768,0.754177,NA
Ridgeview Le Sueur Medical Center (FKA Minnesota Valley Health Center),0.2,0.2,NA
Ridgeview Medical Center (AKA RMC),0.5043787,0.504379,NA
Ridgeview Psychiatric Hospital,0.734589,0.734589,NA
Ridgeview Sibley Medical Center,0.1501712,0.150171,NA
Ringgold County Hospital,0.1804795,0.180479,NA
Rio Grande Hospital,0.396938,0.396938,NA
Rio Grande Regional Hospital,0.566327,0.566327,NA
Rio Grande State Center,0.926924,0.926924,NA
Rio Vista Behavioral Health,NA,NA,NA
Ripon Medical Center,0.2849315,0.284932,NA
Rivendell Behavioral Health Services - Arkansas,0.7817115,0.781712,NA
Rivendell Behavioral Health Services - Kentucky,0.8192458,0.8192458,NA
River Bend Hospital (FKA Wabash Valley Hospital),0.4465753,0.446575,NA
River Crest Hospital,0.6023288,0.602329,NA
River Falls Area Hospital,0.2033973,0.203397,NA
River Hospital,0.1894977,0.189498,NA
River Oaks Hospital,0.6519461,0.6519461,NA
River Park Hospital,0.7383089,0.7383089,NA
River Place Behavioral Health,0.5222272,0.5222272,NA
River Point Behavioral Health,0.4911611,0.491161,NA
River Vista Health and Wellness LLC,0.4171898,0.4171898,NA
RiverBridge Specialty Hospital (FKA Promise Hospital of Miss Lou),0.7024658,0.7024658,NA
RiverValley Behavioral Health,NA,NA,NA
Riveredge Hospital,0.5239661,0.5239661,NA
Riverland Medical Center,0.4494247,0.449425,NA
Rivers Edge Hospital & Clinic,0.4757454,0.475745,NA
Riverside Behavioral Health Center,0.4590671,0.4590671,NA
Riverside Community Hospital,0.6755874,0.675587,NA
Riverside Doctors Hospital Williamsburg,0.3378082,0.3378082,NA
Riverside Hospital of Louisiana,0.8383561,0.838356,NA
Riverside Medical Center,0.4744528,0.474453,NA
Riverside Regional Medical Center,0.719604,0.719604,NA
Riverside Rehabilitation Hospital,0.6030137,0.603014,NA
Riverside Shore Memorial Hospital,0.4857653,0.485765,NA
Riverside Tappahannock Hospital,0.2230628,0.223063,NA
Riverside University Health System Medical Center (FKA Riverside County Regional Medical Center),0.6585702,0.65857,NA
Riverside Walter Reed Hospital,0.4227765,0.422776,NA
Riverton Hospital,0.3972723,0.397272,NA
Riverview Behavioral Health (FKA Vista Health Texarkana),0.6181918,0.6181918,NA
Riverview Health Institute,NA,NA,NA
Riverview Health Noblesville Hospital,0.418886,0.418886,NA
Riverview Health Westfield Hospital,NA,NA,NA
Riverview Hospital (AKA RiverView Health),0.263927,0.263927,NA
Riverview Medical Center,0.5583042,0.558304,NA
Riverview Psychiatric Hospital,0.8044909,0.804491,NA
Riverview Regional Medical Center,0.2634739,0.263474,NA
Riverview Regional Medical Center (FKA Riverview Regional Medical Center North),0.3504657,0.350466,NA
Riverwood Healthcare Center Aitkin Hospital,0.3822466,0.382247,NA
Riverwoods Behavioral Health System,0.9268228,0.926823,NA
Roane General Hospital,0.3139726,0.313973,NA
Roane Medical Center,0.5350896,0.53509,NA
Robert J Dole VA Medical Center,NA,NA,NA
Robert Wood Johnson University Hospital New Brunswick,0.7499034,0.749903,NA
Rochelle Community Hospital,0.1755036,0.175504,NA
Rochester General Hospital,0.8468435,0.846843,NA
Rochester Psychiatric Center,0.9116675,0.9116675,NA
Rock County Hospital,0.08995434,0.089954,NA
Rock Prairie Behavioral Health,0.6343227,0.6343227,NA
Rock Regional Hospital,NA,NA,NA
Rock Springs Hospital,0.7814688,0.7814688,NA
Rockcastle Regional Hospital,0.5021918,0.502192,NA
Rockefeller University Hospital,NA,NA,NA
Rockford Center,0.9865013,0.9865013,NA
Rockland Childrens Psychiatric Center,NA,NA,NA
Rockland Psychiatric Center,0.8109153,0.810915,NA
Rockledge Regional Medical Center (FKA Wuesthoff Medical Center - Rockledge),0.4081292,0.408129,NA
Rockville General Hospital,0.4113618,0.411362,NA
Rocky Mountain Hospital for Children,NA,NA,NA
Roger C Peace Rehabilitation Hospital,NA,NA,NA
Roger Mills Memorial Hospital,0.1583562,0.158356,NA
Roger Williams Medical Center,0.5217512,0.521751,NA
Rogers Memorial Hospital - Oconomowoc,0.697037,0.697037,NA
Rolling Hills Hospital,0.7072708,0.7072708,NA
Rolling Plains Memorial Hospital,0.287882,0.287882,NA
Rome Memorial Hospital,0.3774233,0.377423,NA
Ronald McDonald Childrens Hospital,NA,NA,NA
Ronald Reagan UCLA Medical Center,0.9709792,0.970979,NA
Rooks County Health Center,0.3375,0.3375,NA
Roosevelt General Hospital,0.129589,0.129589,NA
Roosevelt Medical Center,0.6623495,0.66235,NA
Roosevelt Warm Springs Long Term Acute Hospital,0.3961473,0.396147,NA
Roosevelt Warm Springs Rehabilitation Hospital,0.3317703,0.33177,NA
Roper St Francis Healthcare (AKA Berkeley Hospital),NA,NA,NA
Roper St Francis Healthcare - Bon Secours St Francis Hospital,0.524056,0.524056,NA
Roper St Francis Healthcare - Roper Hospital,0.4713803,0.47138,NA
Roper St Francis Healthcare - Roper St Francis Mount Pleasant Hospital,0.3026745,0.3026745,NA
Rose Medical Center,0.4880818,0.488082,NA
Rosebud Community Hospital,0.3422466,0.3422466,NA
Rosebud Service Unit (AKA Rosebud Hospital),0.1026223,0.102622,NA
Roseburg VA Health Care System,NA,NA,NA
Roseland Community Hospital,0.2125537,0.212554,NA
Roswell Park Comprehensive Cancer Center (FKA Roswell Park Cancer Institute),0.8418375,0.841838,NA
Rothman Orthopaedic Specialty Hospital,0.3028539,0.302854,NA
Roundup Memorial Healthcare,0.8432876,0.843288,NA
Roxborough Memorial Hospital,0.3021892,0.302189,NA
Roxbury Treatment Center (FKA Roxbury Psychiatric Hospital),0.8281556,0.8281556,NA
Royal Oaks Hospital,0.7300174,0.730017,NA
Ruby Valley Medical Center,0.2268493,0.226849,NA
Rumford Hospital,0.3878356,0.387836,NA
Runnells Hospital,0.933873,0.933873,NA
Rush Copley Medical Center,0.5095605,0.50956,NA
Rush County Memorial Hospital,1.0,1.0,NA
Rush Foundation Hospital,0.3190275,0.319028,NA
Rush Memorial Hospital,0.1471781,0.147178,NA
Rush Oak Park Hospital,0.2440681,0.244068,NA
Rush University Childrens Hospital (FKA Rush Childrens Hospital),NA,NA,NA
Rush University Medical Center,0.7683027,0.768303,NA
Rusk Rehabilitation Hospital,0.6727397,0.6727397,NA
Rusk Rehabilitation at NYU Langone Orthopedic Hospital,NA,NA,NA
Rusk State Hospital,0.8407004,0.8407004,NA
Russell County Hospital,0.3236164,0.323616,NA
Russell County Hospital (FKA Russell County Medical Center),0.1543193,0.154319,NA
Russell Medical Center,0.4604608,0.460461,NA
Russell Regional Hospital,0.3311305,0.33113,NA
Russellville Hospital,0.3978194,0.397819,NA
Ruston Regional Specialty Hospital (FKA LifeCare Specialty Hospital of North Louisiana - Ruston Campus),0.5998008,0.5998008,NA
Rutherford Regional Medical Center (AKA Rutherford Regional Health System),0.2492163,0.249216,NA
Rutland Regional Medical Center,0.7158197,0.71582,NA
Ryder Memorial Hospital,0.1477958,0.147796,NA
SCL Health Community Hospital Aurora (AKA Saint Joseph Emergency - Aurora),NA,NA,NA
SCL Health Community Hospital Northglenn (AKA Saint Joseph Emergency - Northglenn),NA,NA,NA
SCL Health Community Hospital Southwest (AKA Saint Joseph Emergency - Littleton),NA,NA,NA
SE Texas ER & Hospital,NA,NA,NA
SIH Herrin Hospital,0.6896374,0.689637,NA
SIH Memorial Hospital of Carbondale,0.579493,0.579493,NA
SIH St Joseph Memorial Hospital,0.4986301,0.49863,NA
SLV Health Regional Medical Center,0.3779145,0.377914,NA
SSM Health Cardinal Glennon Childrens Hospital,NA,NA,NA
SSM Health DePaul Hospital - St Louis,0.6403328,0.640333,NA
SSM Health Good Samaritan Hospital - Mt Vernon (FKA Good Samaritan Regional Health Center),0.582258,0.582258,NA
SSM Health Rehabilitation Hospital - Richmond Heights,0.758663,0.758663,NA
SSM Health Saint Louis University Hospital,0.8495244,0.849524,NA
SSM Health St Anthony Hospital - Oklahoma City,0.7226905,0.722691,NA
SSM Health St Anthony Hospital - Shawnee (FKA Unity Health Center),0.4244796,0.42448,NA
SSM Health St Clare Hospital - Baraboo,0.3730488,0.373049,NA
SSM Health St Clare Hospital - Fenton,0.6162709,0.616271,NA
SSM Health St Joseph Hospital - Lake Saint Louis,0.4776761,0.477676,NA
SSM Health St Joseph Hospital - St Charles,0.6937504,0.69375,NA
SSM Health St Marys Hospital - Audrain,0.2893836,0.289384,NA
SSM Health St Marys Hospital - Centralia (FKA St Marys Good Samaritan Inc - Centralia Campus),0.4591714,0.459171,NA
SSM Health St Marys Hospital - Janesville,0.4732603,0.4732603,NA
SSM Health St Marys Hospital - Jefferson City,0.4088754,0.408875,NA
SSM Health St Marys Hospital - Madison,0.6903709,0.690371,NA
SSM Health St Marys Hospital - St Louis,0.5346917,0.534692,NA
SUN Behavioral Columbus,0.7158464,0.7158464,NA
SUN Behavioral Delaware,0.1843352,0.1843352,NA
SUN Behavioral Houston,0.5665124,0.5665124,NA
SUN Behavioral Kentucky,NA,NA,NA
Sabetha Community Hospital,0.281386,0.281386,NA
Sabine County Hospital,0.144,0.144,NA
Sabine Medical Center,0.07962329,0.079623,NA
Sacred Oak Medical Center,0.7933334,0.7933334,NA
Saddleback Medical Center (FKA Saddleback Memorial Medical Center - Laguna Hills),0.4499367,0.449937,NA
Sagamore Childrens Psychiatric Center,NA,NA,NA
Sage Memorial Hospital,0.2075616,0.207562,NA
Sage Rehabilitation Hospital,0.4104516,0.4104516,NA
SageWest - Riverton (FKA Riverton Memorial Hospital),0.1288289,0.128829,NA
Sagecrest Hospital - Grapevine (FKA Ethicus Hospital - Grapevine),0.03474886,0.034749,NA
Saint Agnes Hospital (AKA Saint Agnes Healthcare),0.7089015,0.708901,NA
Saint Agnes Medical Center,0.7931827,0.793183,NA
Saint Alphonsus Medical Center - Baker City,0.2870189,0.287019,NA
Saint Alphonsus Medical Center - Nampa,0.5712044,0.571204,NA
Saint Alphonsus Medical Center - Ontario,0.3016812,0.301681,NA
Saint Alphonsus Regional Medical Center,0.6199811,0.619981,NA
Saint Alphonsus Regional Rehabilitation Hospital,NA,NA,NA
Saint Annes Hospital,0.5870215,0.587021,NA
Saint Anthony Hospital,0.4018349,0.401835,NA
Saint Barnabas Medical Center,0.7483869,0.748387,NA
Saint Camillus Medical Center,0.03418702,0.03418702,NA
Saint Clares Denville Hospital,0.4397977,0.439798,NA
Saint Elizabeths Medical Center,0.2577299,0.25773,NA
Saint Francis Healthcare,0.3262861,0.326286,NA
Saint Francis Hospital,0.7620685,0.343579,NA
Saint Francis Hospital - Bartlett,0.6133649,0.613365,NA
Saint Francis Hospital - Memphis,0.5655817,0.565582,NA
Saint Francis Hospital Muskogee (FKA EASTAR Health System),0.392872,0.392872,NA
Saint Francis Hospital Vinita (FKA Craig General Hospital),0.2325636,0.232564,NA
Saint Francis Hospital and Medical Center,0.6385982,0.638598,NA
Saint Francis Medical Center (AKA Saint Francis Healthcare System),0.4649112,0.464911,NA
Saint Francis Memorial Hospital,0.3114155,0.311416,NA
Saint John Hospital,0.5576588,0.557659,NA
Saint John Vianney Center,NA,NA,NA
Saint Joseph Berea,0.4299178,0.429918,NA
Saint Joseph East,0.4143322,0.414332,NA
Saint Joseph Hospital,0.6862316,0.686232,NA
Saint Joseph Hospital (FKA Exempla St Joseph Hospital),0.6354722,0.635472,NA
Saint Joseph London,0.6349444,0.634944,NA
Saint Joseph Mount Sterling (FKA Mary Chiles Hospital),0.4095238,0.409524,NA
Saint Josephs Medical Center,0.6588817,0.658882,NA
Saint Lukes Community Hospital - Kansas City,NA,NA,NA
Saint Lukes Community Hospital - Leawood,NA,NA,NA
Saint Lukes Community Hospital - North Overland Park,NA,NA,NA
Saint Lukes Community Hospital - Olathe,NA,NA,NA
Saint Lukes Community Hospital - Roeland Park,NA,NA,NA
Saint Lukes Community Hospital - Shawnee,NA,NA,NA
Saint Lukes Community Hospital - South Overland Park,NA,NA,NA
Saint Lukes Cushing Hospital (FKA Cushing Memorial Hospital),0.2872146,0.287215,NA
Saint Lukes East Hospital,0.7443419,0.744342,NA
Saint Lukes Hospital of Kansas City,0.7477229,0.747723,NA
Saint Lukes Hospital of Kansas City Crittenton Childrens Center,NA,NA,NA
Saint Lukes North Hospital - Barry Road,0.628562,0.628562,NA
Saint Lukes Rehabilitation Institute,NA,NA,NA
Saint Lukes South Hospital,0.5793365,0.579337,NA
Saint Marys Hospital,0.6759553,0.675955,NA
Saint Marys Hospital for Children,NA,NA,NA
Saint Marys Regional Medical Center (AKA Saint Marys Health Network),0.6321918,0.632192,NA
Saint Michaels Medical Center,0.6493896,0.64939,NA
Saint Peter Regional Treatment Center,NA,NA,NA
Saint Peters University Hospital,0.6079087,0.607909,NA
Saint Thomas Hospital for Specialty Surgery (FKA the Hospital for Spinal Surgery),0.3392496,0.33925,NA
Saint Vincent Hospital,0.5396942,0.539694,NA
Sakakawea Medical Center,0.3024236,0.3024236,NA
Salem Hospital,0.7065434,0.706543,NA
Salem Medical Center (FKA the Memorial Hospital of Salem County),0.1969897,0.19699,NA
Salem Memorial District Hospital,0.3952877,0.395288,NA
Salem Regional Medical Center (FKA Salem Community Hospital),0.4587939,0.458794,NA
Salem Township Hospital,0.2924932,0.292493,NA
Salem VA Medical Center,NA,NA,NA
Salina Regional Health Center,0.5208791,0.520879,NA
Salina Surgical Hospital,0.3476027,0.347603,NA
Salinas Valley Memorial Hospital,0.5184817,0.518482,NA
Saline Memorial Hospital,0.3826343,0.382634,NA
Salt Lake Behavioral Health,0.5091479,0.5091479,NA
Salt Lake Regional Medical Center,0.2078095,0.20781,NA
Samaritan Albany General Hospital,0.3117154,0.311715,NA
Samaritan Hospital (AKA Samaritan Healthcare),0.5070205,0.50702,NA
Samaritan Hospital - Albany Memorial Campus (FKA Albany Memorial Hospital),0.2434978,0.243498,NA
Samaritan Hospital - Main Campus,0.5899137,0.589914,NA
Samaritan Hospital - St Marys Campus,0.8509589,0.850959,NA
Samaritan Lebanon Community Hospital,0.6256438,0.625644,NA
Samaritan Medical Center,0.7199594,0.719959,NA
Samaritan Memorial Hospital,0.4371507,0.4371507,NA
Samaritan North Lincoln Hospital,0.3544109,0.354411,NA
Samaritan Pacific Communities Hospital,0.4043836,0.404384,NA
Same Day Surgery Center in Rapid City,0.0607306,0.060731,NA
Sampson Regional Medical Center,0.3734131,0.373413,NA
Samuel Mahelona Memorial Hospital,NA,NA,NA
Samuel Simmonds Memorial Hospital,0.06625683,0.06625683,NA
San Angelo Community Medical Center,0.3352923,0.335292,NA
San Antonio Behavioral Healthcare Hospital,0.7993404,0.7993404,NA
San Antonio Military Medical Center (FKA Brooke Army Medical Center),NA,NA,NA
San Antonio Regional Hospital (FKA San Antonio Community Hospital),0.5382241,0.538224,NA
San Antonio State Hospital,0.8128368,0.812837,NA
San Carlos Apache Healthcare (FKA PHS Indian Hospital - San Carlos),0.4010274,0.401027,NA
San Dimas Community Hospital,0.3512329,0.351233,NA
San Francisco VA Health Care System - San Francisco VA Medical Center,NA,NA,NA
San Gabriel Valley Medical Center,0.545689,0.545689,NA
San Gorgonio Memorial Hospital,0.4487312,0.448731,NA
San Joaquin County Mental Health Services Psychiatric Health Facility,NA,NA,NA
San Joaquin General Hospital,0.6314649,0.631465,NA
San Joaquin Valley Rehabilitation Hospital,0.834821,0.834821,NA
San Jorge Childrens & Womens Hospital,NA,NA,NA
San Jose Behavioral Health,0.9214726,0.9214726,NA
San Juan Capestrano Hospital,0.8003345,0.800334,NA
San Juan City Hospital,0.4589828,0.458983,NA
San Juan Hospital,0.1067189,0.106719,NA
San Juan Pan American Hospital,NA,NA,NA
San Juan Regional Medical Center,0.5157832,0.515783,NA
San Juan Regional Rehab Hospital,0.3366819,0.3366819,NA
San Leandro Hospital,0.7363775,0.736378,NA
San Luis Obispo Center,NA,NA,NA
San Mateo Medical Center (AKA San Mateo County Health System),0.3761918,0.376192,NA
San Ramon Regional Medical Center,0.3823588,0.382359,NA
Sana Behavioral Health,0.4796993,0.4796993,NA
Sanford Aberdeen Medical Center,0.2037671,0.2037671,NA
Sanford Bagley Medical Center,0.09358904,0.093589,NA
Sanford Behavioral Health Hospital,0.7126712,0.7126712,NA
Sanford Bemidji Medical Center,0.5390488,0.539049,NA
Sanford Broadway Medical Center,0.730518,0.730518,NA
Sanford Canby Medical Center,0.2094645,0.209464,NA
Sanford Canton-Inwood Medical Center,0.324533,0.324533,NA
Sanford Chamberlain Medical Center,0.190137,0.190137,NA
Sanford Childrens Hospital - Fargo,NA,NA,NA
Sanford Clear Lake Medical Center,0.300274,0.300274,NA
Sanford Hillsboro Medical Center,0.2731164,0.273116,NA
Sanford Jackson Medical Center,0.1741683,0.174168,NA
Sanford Luverne Medical Center,0.2322192,0.232219,NA
Sanford Mayville Medical Center,0.1346849,0.134685,NA
Sanford Medical Center Bismarck (FKA Medcenter One),0.5982359,0.598236,NA
Sanford Medical Center Fargo,NA,NA,NA
Sanford Sheldon Medical Center,0.3552877,0.355288,NA
Sanford Thief River Falls Medical Center,0.3442192,0.344219,NA
Sanford Tracy Medical Center,0.05391781,0.053918,NA
Sanford USD Medical Center,0.6223179,0.622318,NA
Sanford Vermillion Medical Center,0.2464658,0.246466,NA
Sanford Webster Medical Center,0.1260274,0.126027,NA
Sanford Westbrook Medical Center,0.1123288,0.112329,NA
Sanford Wheaton Medical Center,0.09990867,0.099909,NA
Sanford Worthington Medical Center (FKA Regional Hospital Worthington),0.144121,0.144121,NA
Sanpete Valley Hospital,0.2143075,0.214308,NA
Santa Barbara Cottage Hospital,0.6969774,0.696977,NA
Santa Barbara County Psychiatric Health Facility,0.9710616,0.9710616,NA
Santa Clara Valley Medical Center,0.5068694,0.506869,NA
Santa Cruz Valley Regional Hospital (FKA Green Valley Hospital),0.4222001,0.4222001,NA
Santa Fe Service Unit (AKA Santa Fe Indian Hospital),0.05890411,0.058904,NA
Santa Paula Hospital,NA,NA,NA
Santa Rosa Medical Center,0.3610548,0.361055,NA
Santa Rosa Memorial Hospital,0.6689738,0.668974,NA
Santa Ynez Valley Cottage Hospital,0.1514321,0.151432,NA
Santiam Memorial Hospital,0.205137,0.205137,NA
Sarah Bush Lincoln Health Center,0.5960909,0.596091,NA
Sarah D Culbertson Memorial Hospital,0.1674969,0.167497,NA
Sarasota Memorial Hospital,0.5846637,0.584664,NA
Saratoga Hospital,0.8078026,0.807803,NA
Satanta District Hospital,0.1789252,0.1789252,NA
Sauk Prairie Memorial Hospital,0.2355403,0.23554,NA
Saunders Medical Center,0.1313356,0.131336,NA
Savoy Medical Center,0.06267123,0.062671,NA
Scenic Mountain Medical Center,0.283105,0.283105,NA
Scheurer Hospital,0.2366027,0.236603,NA
Schleicher County Medical Center,0.06771037,0.06771,NA
Schneck Medical Center,0.2629836,0.262984,NA
Schneider Regional Medical Center,0.2803226,0.280323,NA
Schoolcraft Memorial Hospital,0.3878995,0.3879,NA
Schuyler Hospital,0.3964931,0.396493,NA
Schwab Rehabilitation Hospital (FKA Schwab Rehab Hospital & Care Network),0.7215525,0.721553,NA
Scotland County Hospital,0.3448767,0.344877,NA
Scotland Memorial Hospital,0.5108318,0.510832,NA
Scott County Hospital,0.4046027,0.404603,NA
Scott Memorial Hospital,0.3185754,0.318575,NA
Scott Regional Hospital (AKA Scott Regional Medical Center),0.3943014,0.394301,NA
Scottish Rite Hospital (FKA Childrens Healthcare Scottish Rite),0.596745,0.596745,NA
Scripps Green Hospital,0.5388128,0.538813,NA
Scripps Memorial Hospital Encinitas,0.7311704,0.73117,NA
Scripps Memorial Hospital La Jolla,0.6240495,0.62405,NA
Scripps Mercy Hospital San Diego,0.7104892,0.710489,NA
Sea Pines Rehabilitation Hospital (FKA Healthsouth Sea Pines Rehab Hospital),0.6550076,0.655008,NA
Seaside Behavioral Center - Metairie,NA,NA,NA
Seaside Behavioral Center - New Orleans,0.8648208,0.8648208,NA
Seaside Health System - Baton Rouge,0.8342466,0.8342466,NA
Seattle Cancer Care Alliance,0.9182191,0.918219,NA
Seattle Childrens Hospital,0.7698638,0.769864,NA
Sebastian River Medical Center,0.4698743,0.469874,NA
Sedan City Hospital,0.09863014,0.09863,NA
Sedgwick County Health Center,0.2228311,0.222831,NA
Seiling Municipal Hospital,0.2429224,0.242922,NA
Selby General Hospital Campus,0.3535343,0.353534,NA
Select Rehabilitation Hospital of Denton,0.5102117,0.5102117,NA
Select Rehabilitation Hospital of San Antonio (FKA Globalrehab - San Antonio),0.6588389,0.6588389,NA
Select Specialty Hospital - Akron,0.7142466,0.7142466,NA
Select Specialty Hospital - Ann Arbor,0.848478,0.848478,NA
Select Specialty Hospital - Augusta,0.5597603,0.55976,NA
Select Specialty Hospital - Battle Creek,0.6384658,0.638466,NA
Select Specialty Hospital - Belhaven,0.9117808,0.9117808,NA
Select Specialty Hospital - Birmingham,0.6421053,0.6421053,NA
Select Specialty Hospital - Boardman,0.723279,0.723279,NA
Select Specialty Hospital - Camp Hill,0.777427,0.777427,NA
Select Specialty Hospital - Canton,0.6656621,0.665662,NA
Select Specialty Hospital - Charleston,0.9175514,0.9175514,NA
Select Specialty Hospital - Cincinnati,0.5647475,0.5647475,NA
Select Specialty Hospital - Cincinnati North,0.4114267,0.411427,NA
Select Specialty Hospital - Cleveland Gateway,0.3231152,0.3231152,NA
Select Specialty Hospital - Columbus,0.4459714,0.4459714,NA
Select Specialty Hospital - Columbus East,0.4948728,0.4948728,NA
Select Specialty Hospital - Columbus South,0.5046908,0.5046908,NA
Select Specialty Hospital - Dallas,0.5805938,0.5805938,NA
Select Specialty Hospital - Dallas Downtown,0.4261795,0.4261795,NA
Select Specialty Hospital - Danville,0.7747945,0.774795,NA
Select Specialty Hospital - Daytona Beach,0.826672,0.826672,NA
Select Specialty Hospital - Des Moines,0.7846575,0.7846575,NA
Select Specialty Hospital - Downriver,0.7814779,0.781478,NA
Select Specialty Hospital - Durham,0.8673972,0.867397,NA
Select Specialty Hospital - Erie,0.4537534,0.453753,NA
Select Specialty Hospital - Evansville,0.7105479,0.7105479,NA
Select Specialty Hospital - Flint,0.7733403,0.7733403,NA
Select Specialty Hospital - Fort Myers (FKA Promise Hospital of Fort Myers),0.6468847,0.6468847,NA
Select Specialty Hospital - Fort Smith,0.6532635,0.653263,NA
Select Specialty Hospital - Gainesville,0.9239103,0.92391,NA
Select Specialty Hospital - Greensboro,0.913516,0.913516,NA
Select Specialty Hospital - Gulfport,0.4680889,0.468089,NA
Select Specialty Hospital - Hampton Roads,0.7455342,0.7455342,NA
Select Specialty Hospital - Jackson,0.8432153,0.8432153,NA
Select Specialty Hospital - Johnstown,0.6540704,0.6540704,NA
Select Specialty Hospital - Kansas City,0.835,0.835,NA
Select Specialty Hospital - Knoxville,0.7619048,0.761905,NA
Select Specialty Hospital - Laurel Highlands,0.5005479,0.5005479,NA
Select Specialty Hospital - Lexington,0.6897427,0.689743,NA
Select Specialty Hospital - Lincoln,0.7378995,0.7378995,NA
Select Specialty Hospital - Longview,0.6686644,0.668664,NA
Select Specialty Hospital - Macomb,0.8337701,0.83377,NA
Select Specialty Hospital - Madison,0.6752952,0.675295,NA
Select Specialty Hospital - McKeesport,0.6649315,0.6649315,NA
Select Specialty Hospital - Memphis,0.8552862,0.8552862,NA
Select Specialty Hospital - Miami,0.8105509,0.810551,NA
Select Specialty Hospital - Miami Lakes (FKA Promise Hospital of Miami),0.7336966,0.7336966,NA
Select Specialty Hospital - Midtown Atlanta,0.5275,0.5275,NA
Select Specialty Hospital - Milwaukee West Allis,0.7387258,0.738726,NA
Select Specialty Hospital - Muskegon (FKA Great Lakes Specialty Hospital - Hackley),0.6259832,0.6259832,NA
Select Specialty Hospital - Nashville,0.8123679,0.8123679,NA
Select Specialty Hospital - North Knoxville,0.8311039,0.8311039,NA
Select Specialty Hospital - Northeast New Jersey,0.5019001,0.5019,NA
Select Specialty Hospital - Northern Kentucky,0.5028642,0.5028642,NA
Select Specialty Hospital - Northwest Detroit,0.7297668,0.7297668,NA
Select Specialty Hospital - Oklahoma City,0.8614536,0.8614536,NA
Select Specialty Hospital - Omaha,0.5534247,0.5534247,NA
Select Specialty Hospital - Orlando North,0.7692542,0.7692542,NA
Select Specialty Hospital - Palm Beach,0.8589498,0.85895,NA
Select Specialty Hospital - Pensacola,0.7703744,0.770374,NA
Select Specialty Hospital - Phoenix,0.8744863,0.8744863,NA
Select Specialty Hospital - Pittsburgh UPMC,0.7112157,0.7112157,NA
Select Specialty Hospital - Quad Cities,0.4508493,0.450849,NA
Select Specialty Hospital - Saginaw,0.639726,0.639726,NA
Select Specialty Hospital - San Diego (FKA Vibra Hospital of San Diego),0.5319054,0.5319054,NA
Select Specialty Hospital - Savannah,0.6537671,0.653767,NA
Select Specialty Hospital - South Atlanta (FKA Regency Hospital of South Atlanta),0.6728767,0.6728767,NA
Select Specialty Hospital - South Dakota,0.8022831,0.802283,NA
Select Specialty Hospital - Southeast Ohio (FKA Select Specialty Hospital - Zanesville),0.6684932,0.6684932,NA
Select Specialty Hospital - Spectrum Health (FKA Select Specialty Hospital - Grand Rapids),0.7833334,0.7833334,NA
Select Specialty Hospital - Springfield,0.6277708,0.627771,NA
Select Specialty Hospital - St Louis,0.6187085,0.618708,NA
Select Specialty Hospital - Tallahassee,0.6263128,0.6263128,NA
Select Specialty Hospital - The Villages (FKA Promise Hospital of Florida at the Villages),0.7348732,0.7348732,NA
Select Specialty Hospital - Town and Country,NA,NA,NA
Select Specialty Hospital - Tri Cities,0.9278539,0.9278539,NA
Select Specialty Hospital - Tulsa,0.4611057,0.4611057,NA
Select Specialty Hospital - Wichita,0.8442352,0.8442352,NA
Select Specialty Hospital - Wilmington,0.8584736,0.858474,NA
Select Specialty Hospital - Youngstown,0.5807534,0.580753,NA
Self Regional Healthcare,0.4722437,0.472244,NA
Sells Indian Hospital,0.1919765,0.191976,NA
Seneca Healthcare District Hospital,0.2106849,0.210685,NA
Sentara Albemarle Medical Center,0.5888304,0.58883,NA
Sentara CarePlex Hospital,0.6466072,0.646607,NA
Sentara Halifax Regional Hospital,0.3731661,0.373166,NA
Sentara Leigh Hospital,0.8126782,0.812678,NA
Sentara Martha Jefferson Hospital,0.6151598,0.61516,NA
Sentara Norfolk General Hospital,0.8153589,0.815359,NA
Sentara Northern Virginia Medical Center (FKA Potomac Hospital),0.7578231,0.757823,NA
Sentara Obici Hospital,0.6681219,0.668122,NA
Sentara Princess Anne Hospital,0.7762557,0.7762557,NA
Sentara RMH Medical Center (FKA Rockingham Memorial Hospital),0.5856452,0.585645,NA
Sentara Virginia Beach General Hospital,0.786211,0.786211,NA
Sentara Williamsburg Regional Medical Center,0.616872,0.616872,NA
Sequoia Hospital,0.2470036,0.247004,NA
Serenity Springs Specialty Hospital,0.7945206,0.794521,NA
Seton Medical Center,0.2083266,0.208327,NA
Seton Medical Center Coastside,NA,NA,NA
Seton Medical Center Harker Heights,0.3947281,0.3947281,NA
Seven Hills Hospital,0.6396647,0.6396647,NA
Sevier Valley Hospital,0.25,0.25,NA
Seymour Hospital,0.1881279,0.188128,NA
Sgt John L Levitow Veterans Health Center (AKA Rocky Hill Veterans Home),0.7301266,0.730127,NA
